{"boundary_test":{"environment":"DG_ENGINE_I0_BOUNDARY_TEST","faults":["crash","hang","fork-setsid-descendant","stdout-output","stderr-output","buffered-print","malformed-result","truncated-result","multiple-results","oversized-result","preload","extra-thread","wrong-candidate","wrong-tree","wrong-environment","wrong-worker-hash","wrong-interpreter-hash","wrong-reference-lock-hash","wrong-harness-lock-hash","wrong-evidence-hash","forged-counts","forged-test-ids","forged-blockers","forged-gate","wrong-disposition","wrong-nonce-result","wrong-paths","truncated-authenticated-result","multiple-authenticated-results","wrong-exit","oracle-mutation","oracle-dependency-mutation","spawn-failure","wrong-worker-argument","wrong-environment-root","wrong-interpreter-image","wrong-nonce-argument","worker-substitution","worker-fd-substitution","result-fd-read-only","result-fd-duplicate","result-fd-regular"],"source_id":"boundary-tests"},"candidate":{"inventory_sha256":"b378022441832569326db5bb116afacd01d92555d22747c71a77a517949d2b05","relevant_paths":["engine-design/fixtures/i0/baseline-defects.json","engine-design/fixtures/i0/semantics.json","engine-design/i0-harness.lock.json","engine-design/node-modes.json","engine-design/reference.lock.json","engine-design/schemas/i0/baseline-defects.schema.json","engine-design/schemas/i0/command-log.schema.json","engine-design/schemas/i0/derivation-record.schema.json","engine-design/schemas/i0/evidence-manifest.schema.json","engine-design/schemas/i0/harness-lock.schema.json","engine-design/schemas/i0/node-modes.schema.json","engine-design/schemas/i0/reference-lock.schema.json","engine-design/schemas/i0/semantics.schema.json","engine-design/tests/i0_evidence.py","engine-design/tests/i0_oracle_worker.py","engine-design/tests/i0_testlib.py","engine-design/tests/run_i0_group.py","engine-design/tests/test_base_01.py","engine-design/tests/test_base_01_security.py","engine-design/tests/test_base_02.py","engine-design/tests/test_base_02_defects.py","engine-design/tests/test_base_02_policy.py","engine-design/tests/test_base_02_semantics.py","engine-design/tests/test_i0_worker_boundary.py"]},"environment":{"manifest_path":"/tmp/dg-engine-i0-oracle-environment/manifest.json","manifest_sha256":"d9d501e03b8d93ad8a940c1e7b883b599b319438d717e26f9eacd1bd715c2db9","merkle_sha256":"d9f8a9e4e18f9d53cf867f8e28ae11689fd5542b48500ccb462708079d04228e","record_policy":{"allow_omitted":["*.pth"],"verify_all":true},"roots":[{"entry_count":1215,"id":"stdlib","merkle_sha256":"d3134399c59c3a1fa8d6fc1c9c0475c0e935c0e7d890d2e18ef374459a8a56e6","path":"/usr/lib/python3.12"},{"entry_count":31561,"id":"site-packages","merkle_sha256":"3b26f95085b3f4c03e54773509847385f1b4e70c16b16773235ae215afa5d5c3","path":"/tmp/dg-engine-i0-oracle-environment/site-packages"}],"sys_path":["/usr/lib/python3.12","/usr/lib/python3.12/lib-dynload","/tmp/dg-engine-i0-oracle-environment/site-packages"]},"git_tool":{"path":"/usr/bin/git","sha256":"2a8c18fbf43da9f692d75474c72bea9dfd796c260b0f3dfe456376abc3bbd668","size":4066232},"interpreter":{"image":{"dev":117,"ino":60335201,"path":"/usr/bin/python3.12","sha256":"1643dacd9feaedc58f3cc581e4d22577dfe25c09b10282936186ccf0f2e61118","size":8020928},"launcher_path":"build/i0-oracle-venv/bin/python"},"kind":"dg-engine-i0-harness-lock","result_contract":{"max_bytes":32768,"max_side_bytes":4096,"schema":3},"schema":2,"sources":[{"groups":["COMMON"],"id":"parent-runner","kind":"python","path":"engine-design/tests/run_i0_group.py","sha256":"2bf9d221a0dde0e7028f6775337f3aad59f14ae8d16c23b58d3006e6336725ae","size":44919},{"groups":["COMMON"],"id":"oracle-worker","kind":"python","path":"engine-design/tests/i0_oracle_worker.py","sha256":"903ca962da8b9242297668304853f357468456086f76545e2c6045d754c23a75","size":23558},{"groups":["COMMON"],"id":"i0-evidence","kind":"python","path":"engine-design/tests/i0_evidence.py","sha256":"e2103c04d5980e00f0e9c7f16cb2567abac5052e8f5b958dd18ca3e64f8a1dde","size":207127},{"groups":["COMMON"],"id":"i0-testlib","kind":"python","path":"engine-design/tests/i0_testlib.py","sha256":"51d9d07c52b48ab0128b26b6526b3907ebfa3b80c73b3acedbb026f3c977b082","size":6194},{"groups":["COMMON"],"id":"reference-lock","kind":"json","path":"engine-design/reference.lock.json","sha256":"b1e232b1622b012b380aebf1e43a8d646310155eeb14a892ee2bae5510a380c7","size":104522},{"groups":["COMMON"],"id":"node-modes","kind":"json","path":"engine-design/node-modes.json","sha256":"47a4efa53967da5d3111f510dc6ef43fc130485b7ec33712f3416b1f5584f1b5","size":46309},{"groups":["COMMON"],"id":"semantics-fixture","kind":"json","path":"engine-design/fixtures/i0/semantics.json","sha256":"825e2820a6804fda18d0878f36f549870e447f7aff5f2f82605cc1fd88d8d0ec","size":7083},{"groups":["COMMON"],"id":"defects-fixture","kind":"json","path":"engine-design/fixtures/i0/baseline-defects.json","sha256":"a61b1e26fe302b6eae87a8838f331d3d11f4c8ddd7ae4a6e5e916d9d02004701","size":3809},{"groups":["COMMON"],"id":"baseline-defects-schema","kind":"schema","path":"engine-design/schemas/i0/baseline-defects.schema.json","sha256":"c3000bd177935c5debd8d466d84cddc0ff311c032232472a423f9c87468d033a","size":2105},{"groups":["COMMON"],"id":"command-log-schema","kind":"schema","path":"engine-design/schemas/i0/command-log.schema.json","sha256":"23fae38116236d409553f7b1047100c5eb05ae2c5923be6825ba090346fcd629","size":8386},{"groups":["COMMON"],"id":"derivation-record-schema","kind":"schema","path":"engine-design/schemas/i0/derivation-record.schema.json","sha256":"6c51ec86f66c021a258bd0b6a4622ba2c24fc4af523c01a6feebc330388c07fd","size":8083},{"groups":["COMMON"],"id":"evidence-manifest-schema","kind":"schema","path":"engine-design/schemas/i0/evidence-manifest.schema.json","sha256":"523fc9b2bacbe174e18033f9338324637ccaa55e8951b9290d26744fbd20ccf0","size":5617},{"groups":["COMMON"],"id":"harness-lock-schema","kind":"schema","path":"engine-design/schemas/i0/harness-lock.schema.json","sha256":"5b31476af34056b4cd24d55bf035b44844a1be3311231575f1d90d6322c5558d","size":5612},{"groups":["COMMON"],"id":"node-modes-schema","kind":"schema","path":"engine-design/schemas/i0/node-modes.schema.json","sha256":"db8a703801864e252a8ab97d78a55fc5a86553d8c2dece1e9f39ed7fc8217d5c","size":12798},{"groups":["COMMON"],"id":"reference-lock-schema","kind":"schema","path":"engine-design/schemas/i0/reference-lock.schema.json","sha256":"e59ca8aa56a83dc5d10e5e4b7f5e1a19a5e4640261bac3eee78a07be6e86a3e8","size":52825},{"groups":["COMMON"],"id":"semantics-schema","kind":"schema","path":"engine-design/schemas/i0/semantics.schema.json","sha256":"263c69657533388f21e50b87dad05edf71257f189de7894bfaa94eee1faebc4c","size":17908},{"groups":["BASE-01"],"id":"base-01-tests","kind":"python","path":"engine-design/tests/test_base_01.py","sha256":"fb530c4c8883d2879fcbb117a260deccae6e0a8a21492a6e886b0f38e8e008e1","size":10601},{"groups":["BASE-01"],"id":"base-01-security-tests","kind":"python","path":"engine-design/tests/test_base_01_security.py","sha256":"9d072b0e1010fd2db095a5339e1d6ed6b9dbb84492ccf3ac30e663dfce3c2575","size":68562},{"groups":["BASE-02"],"id":"base-02-tests","kind":"python","path":"engine-design/tests/test_base_02.py","sha256":"23c8c971215830cbf8c0a669624f3065e83385bffa91b5999f012f0f8ec1e404","size":15771},{"groups":["BASE-02"],"id":"base-02-defect-tests","kind":"python","path":"engine-design/tests/test_base_02_defects.py","sha256":"d4e242867bda772735414387fa90e5de7b3980ec7488565ba572ca7be6efe5de","size":9219},{"groups":["BASE-02"],"id":"base-02-policy-tests","kind":"python","path":"engine-design/tests/test_base_02_policy.py","sha256":"913def6671f504c4f85ecacd72e135751ca15ebf90b029f3826efdad59b88095","size":14536},{"groups":["BASE-02"],"id":"base-02-semantic-tests","kind":"python","path":"engine-design/tests/test_base_02_semantics.py","sha256":"0f0a9b54c7ddcaeace265e9f554cc726725275e776bea3a61b280782526006b5","size":17908},{"groups":["BOUNDARY"],"id":"boundary-tests","kind":"python","path":"engine-design/tests/test_i0_worker_boundary.py","sha256":"2054351f084d2974feecaa2aac52a61409a03a42a2dfe670a31f6571c8a08ed2","size":9625}],"test_groups":{"BASE-01":{"count":50,"inventory_sha256":"1942d27c64ba2b347b80643ffab76e839b9f6068d4571b25bba1eefbde354127","source_ids":["parent-runner","oracle-worker","i0-evidence","i0-testlib","reference-lock","node-modes","semantics-fixture","defects-fixture","baseline-defects-schema","command-log-schema","derivation-record-schema","evidence-manifest-schema","harness-lock-schema","node-modes-schema","reference-lock-schema","semantics-schema","base-01-tests","base-01-security-tests"],"test_ids":["test_base_01.Base01InventoryTests.test_all_complete_object_info_projections_match_pinned_algorithm","test_base_01.Base01InventoryTests.test_all_new_json_schemas_and_records_validate","test_base_01.Base01InventoryTests.test_baseline_and_checkout_node_sources_are_byte_identical","test_base_01.Base01InventoryTests.test_every_input_choice_optional_hidden_socket_and_return_is_concrete","test_base_01.Base01InventoryTests.test_every_loaded_product_module_was_authenticated_before_execution","test_base_01.Base01InventoryTests.test_inventory_source_hashes_are_current_bytes_and_baseline_blobs","test_base_01.Base01InventoryTests.test_mode_statuses_preserve_broken_and_fail_loud_distinctions","test_base_01.Base01InventoryTests.test_pinned_comfyui_projection_source_is_authenticated","test_base_01.Base01InventoryTests.test_schema_and_exact_registration","test_base_01_security.DerivationSecurityTests.test_all_cross_gguf_path_and_inode_role_aliases_are_rejected","test_base_01_security.DerivationSecurityTests.test_arbitrary_and_oversized_command_logs_are_rejected","test_base_01_security.DerivationSecurityTests.test_bound_policy_requires_exactly_three_bound_lineages","test_base_01_security.DerivationSecurityTests.test_cross_lineage_log_log_id_collision_is_rejected","test_base_01_security.DerivationSecurityTests.test_cross_lineage_record_log_id_collision_is_rejected","test_base_01_security.Deriva